objectid,filename,title,creator,date,description,subject,location,latitude,longitude,source,identifier,type,format,language,rights,rightsstatement,object_template,object_download,image_small,image_thumb
ibp1737,ibp000.jpg,The color of deep water: The story of Polly Bemis,"Reddy, S. D., & Payette National Forest",1994,,Chinese People,State of Idaho,44.0682,-114.742,,,Text,,eng,,,book_record,https://lib.uidaho.edu/digital/objects/idahobib/ibp000.jpg,,
ibp1738,ibp000.jpg,"Chinese material culture in Owyhee County: Ceramic artifacts from Silver City, Idaho","Sandmeyer, M. C.",2006,,Chinese People,State of Idaho,44.0682,-114.742,,,Text,,eng,,,book_record,https://lib.uidaho.edu/digital/objects/idahobib/ibp000.jpg,,
ibp1739,ibp000.jpg,The vanishing: Re-presenting the Chinese in the American West,Sun Valley Center for the Arts,2004,,Chinese People,State of Idaho,44.0682,-114.742,,,Text,,eng,,,book_record,https://lib.uidaho.edu/digital/objects/idahobib/ibp000.jpg,,
ibp1740,ibp000.jpg,The influence of Asians in Idaho history,unknown,1964,,Chinese People,State of Idaho,44.0682,-114.742,,,Text,,eng,,,book_record,https://lib.uidaho.edu/digital/objects/idahobib/ibp000.jpg,,
ibp1741,ibp000.jpg,The history of the Chinese in Idaho from 1864 to 1910,"Trull, F. C.",1946,,Chinese People,State of Idaho,44.0682,-114.742,,,Text,,eng,,,book_record,https://lib.uidaho.edu/digital/objects/idahobib/ibp000.jpg,,
ibp1742,ibp000.jpg,The history and archaeology of the Chinese in northern Idaho,"Wegars, P.",1991,,Chinese People,State of Idaho,44.0682,-114.742,,,Text,,eng,,,book_record,https://lib.uidaho.edu/digital/objects/idahobib/ibp000.jpg,,
ibp1743,ibp1743.jpg,"Polly Bemis, a Chinese American pioneer","Wegars, P.",2003,,Chinese People,State of Idaho,44.0682,-114.742,,,Text,,eng,,,book_record,https://lib.uidaho.edu/digital/objects/idahobib/ibp1743.jpg,https://lib.uidaho.edu/digital/objects/idahobib/small/ibp1743_sm.jpg,https://lib.uidaho.edu/digital/objects/idahobib/thumbs/ibp1743_th.jpg
ibp1744,ibp1744.jpg,"Uncovering a Chinese legacy: Historical archaeology at Centerville, Idaho, once the ""handsomest town in the basin""","Wegars, P., Xu, Y., United States., & University of Idaho",2001,,Chinese People,State of Idaho,44.0682,-114.742,,,Text,,eng,,,book_record,https://lib.uidaho.edu/digital/objects/idahobib/ibp1744.jpg,https://lib.uidaho.edu/digital/objects/idahobib/small/ibp1744_sm.jpg,https://lib.uidaho.edu/digital/objects/idahobib/thumbs/ibp1744_th.jpg
ibp1745,ibp1745.jpg,"Reaction to the Chinese in the Pacific Northwest and British Columbia, 1850-1910","Wynne, R. E.",1978,,Chinese People,State of Idaho,44.0682,-114.742,,,Text,,eng,,,book_record,https://lib.uidaho.edu/digital/objects/idahobib/ibp1745.jpg,https://lib.uidaho.edu/digital/objects/idahobib/small/ibp1745_sm.jpg,https://lib.uidaho.edu/digital/objects/idahobib/thumbs/ibp1745_th.jpg
ibp1746,ibp000.jpg,Chinese immigrants in Idaho,"Yu, L.",1991,,Chinese People,State of Idaho,44.0682,-114.742,,,Text,,eng,,,book_record,https://lib.uidaho.edu/digital/objects/idahobib/ibp000.jpg,,
ibp1747,ibp000.jpg,Achieving conversion: A Chinese ethnography of the Boise Chinese Christian Fellowship,"Zhu, H.",2002,,Chinese People,State of Idaho,44.0682,-114.742,,,Text,,eng,,,book_record,https://lib.uidaho.edu/digital/objects/idahobib/ibp000.jpg,,
ibp1748,ibp1748.jpg,The galloping ghosts of Galena,"Barber, P. E., & Wyman, P. R.",2008,,Ghost Towns,State of Idaho,44.0682,-114.742,,,Text,,eng,,,book_record,https://lib.uidaho.edu/digital/objects/idahobib/ibp1748.jpg,https://lib.uidaho.edu/digital/objects/idahobib/small/ibp1748_sm.jpg,https://lib.uidaho.edu/digital/objects/idahobib/thumbs/ibp1748_th.jpg
ibp1749,ibp1749.jpg,"Montana, Idaho, and Wyoming ghost towns","Florin, L.",1971,,Ghost Towns,State of Idaho,44.0682,-114.742,,,Text,,eng,,,book_record,https://lib.uidaho.edu/digital/objects/idahobib/ibp1749.jpg,https://lib.uidaho.edu/digital/objects/idahobib/small/ibp1749_sm.jpg,https://lib.uidaho.edu/digital/objects/idahobib/thumbs/ibp1749_th.jpg
ibp1750,ibp000.jpg,Idaho ghost towns,Idaho State Historical Society,1964,,Ghost Towns,State of Idaho,44.0682,-114.742,,,Text,,eng,,,book_record,https://lib.uidaho.edu/digital/objects/idahobib/ibp000.jpg,,
ibp1751,ibp000.jpg,"Idaho ghost towns: Past and present, with special insert on the Yankee Fork",Idaho Dept. of Commerce and Development,1960,,Ghost Towns,State of Idaho,44.0682,-114.742,,,Text,,eng,,,book_record,https://lib.uidaho.edu/digital/objects/idahobib/ibp000.jpg,,
ibp1752,ibp1752.jpg,Ghost towns of Idaho,"Miller, D. C.",1976,,Ghost Towns,State of Idaho,44.0682,-114.742,,,Text,,eng,,,book_record,https://lib.uidaho.edu/digital/objects/idahobib/ibp1752.jpg,https://lib.uidaho.edu/digital/objects/idahobib/small/ibp1752_sm.jpg,https://lib.uidaho.edu/digital/objects/idahobib/thumbs/ibp1752_th.jpg
ibp1753,ibp1753.jpg,"Idaho's bonanza years: Ghost towns, their history and how to find them","Painter, R., & Povey, D.",1966,,Ghost Towns,State of Idaho,44.0682,-114.742,,,Text,,eng,,,book_record,https://lib.uidaho.edu/digital/objects/idahobib/ibp1753.jpg,https://lib.uidaho.edu/digital/objects/idahobib/small/ibp1753_sm.jpg,https://lib.uidaho.edu/digital/objects/idahobib/thumbs/ibp1753_th.jpg
ibp1754,ibp000.jpg,Ghost mining camps of Idaho: Their history and how to find them,"Povey, D.",1984,,Ghost Towns,State of Idaho,44.0682,-114.742,,,Text,,eng,,,book_record,https://lib.uidaho.edu/digital/objects/idahobib/ibp000.jpg,,
ibp1755,ibp1755.jpg,Ghost towns of Idaho: The search for El Dorado,"Raisch, B. A.",2008,,Ghost Towns,State of Idaho,44.0682,-114.742,,,Text,,eng,,,book_record,https://lib.uidaho.edu/digital/objects/idahobib/ibp1755.jpg,https://lib.uidaho.edu/digital/objects/idahobib/small/ibp1755_sm.jpg,https://lib.uidaho.edu/digital/objects/idahobib/thumbs/ibp1755_th.jpg
ibp1756,ibp000.jpg,"Ghost towns and live ones: A chronology of the Postoffice Dept. in Idaho, 1861-1973","Schell, F. R.",1973,,Ghost Towns,State of Idaho,44.0682,-114.742,,,Text,,eng,,,book_record,https://lib.uidaho.edu/digital/objects/idahobib/ibp000.jpg,,
ibp1757,ibp000.jpg,Faded memories,"Smith, L. J., & Fogle, B. L.",1996,,Ghost Towns,State of Idaho,44.0682,-114.742,,,Text,,eng,,,book_record,https://lib.uidaho.edu/digital/objects/idahobib/ibp000.jpg,,
ibp1758,ibp1758.jpg,Southern Idaho ghost towns,"Sparling, W. C.",1974,,Ghost Towns,State of Idaho,44.0682,-114.742,,,Text,,eng,,,book_record,https://lib.uidaho.edu/digital/objects/idahobib/ibp1758.jpg,https://lib.uidaho.edu/digital/objects/idahobib/small/ibp1758_sm.jpg,https://lib.uidaho.edu/digital/objects/idahobib/thumbs/ibp1758_th.jpg
ibp1759,ibp1759.jpg,Proving the principle: A history of the Idaho National Engineering and Environmental Laboratory,"Stacy, S. M., Jason Associates Corporation., Idaho National Engineering and Environmental Laboratory., & United States",2000,,Nuclear,State of Idaho,44.0682,-114.742,,,Text,,eng,,,book_record,https://lib.uidaho.edu/digital/objects/idahobib/ibp1759.jpg,https://lib.uidaho.edu/digital/objects/idahobib/small/ibp1759_sm.jpg,https://lib.uidaho.edu/digital/objects/idahobib/thumbs/ibp1759_th.jpg
ibp1760,ibp000.jpg,"Photographs, written historical and descriptive data: Idaho National Engineering Laboratory, Advanced Reentry Vehicle Fuzing System, Scoville vicinity, Butte County, Idaho",Historic American Buildings Survey/Historic American Engineering Record,1997,,Nuclear,State of Idaho,44.0682,-114.742,,,Text,,eng,,,book_record,https://lib.uidaho.edu/digital/objects/idahobib/ibp000.jpg,,
ibp1761,ibp000.jpg,"Idaho National Engineering Laboratory Army Reactors Experimental Area Historic American Engineering Record report--ID-33-D. Idaho Falls, Idaho: Idaho National Laboratory","Historic American Engineering Record., Idaho National Laboratory., United States., United States., & United States",1997,,Nuclear,State of Idaho,44.0682,-114.742,,,Text,,eng,,,book_record,https://lib.uidaho.edu/digital/objects/idahobib/ibp000.jpg,,
ibp1762,ibp000.jpg,Idaho National Engineering Laboratory: A thumbnail history,Idaho National Engineering Laboratory,1987,,Nuclear,State of Idaho,44.0682,-114.742,,,Text,,eng,,,book_record,https://lib.uidaho.edu/digital/objects/idahobib/ibp000.jpg,,
ibp1763,ibp000.jpg,"Photographs, written historical and descriptive data: Idaho National Engineering Laboratory, Test Area North, Hangar 629, Scoville","Stacy, S. M., & Historic American Buildings Survey/Historic American Engineering Record",1995,,Nuclear,State of Idaho,44.0682,-114.742,,,Text,,eng,,,book_record,https://lib.uidaho.edu/digital/objects/idahobib/ibp000.jpg,,
ibp1764,ibp000.jpg,"Photographs, written historical and descriptive data: Idaho National Engineering and Environmental Laboratory, Old Waste Calcining Facility, Scoville vicinity, Butte County, Idaho. Seattle, Wash: Historic American Engineering Record, National Park Service, Western Region, Dept. of the Interior","Stacy, S. M., & Historic American Buildings Survey/Historic American Engineering Record",1998,,Nuclear,State of Idaho,44.0682,-114.742,,,Text,,eng,,,book_record,https://lib.uidaho.edu/digital/objects/idahobib/ibp000.jpg,,
ibp1765,ibp000.jpg,"Photographs, written historical and descriptive data: Idaho National Engineering and Environmental Laboratory, Test Area North, Scoville Vicinity, Butte County, Idaho","Stacy, S. M., & Historic American Buildings Survey/Historic American Engineering Record",2004,,Nuclear,State of Idaho,44.0682,-114.742,,,Text,,eng,,,book_record,https://lib.uidaho.edu/digital/objects/idahobib/ibp000.jpg,,
ibp1766,ibp000.jpg,"Photographs, written historical and descriptive data: Idaho National Engineering and Environmental Laboratory, SPERT-I and Power Burst Facility Area, Scoville vicinity, Butte County, Idaho","Stacy, S. M., & Historic American Buildings Survey/Historic American Engineering Record",2005,,Nuclear,State of Idaho,44.0682,-114.742,,,Text,,eng,,,book_record,https://lib.uidaho.edu/digital/objects/idahobib/ibp000.jpg,,
ibp1767,ibp000.jpg,"Photographs, written historical and descriptive data: Idaho National Engineering Laboratory, Test Reactor Area, Materials Testing & Engineering Test Reactors (Idaho National Laboratory, Test Reactor Area, Materials Testing & Engineering Test Reactors), Scoville vicinity, Butte County, Idaho /c[report prepared by Susan M. Stacy]. Seattle, WA: Historic American Engineering Record, National Park Service, Western Region, Dept. of the Interior","Stacy, S. M., & Historic American Buildings Survey/Historic American Engineering Record",2006,,Nuclear,State of Idaho,44.0682,-114.742,,,Text,,eng,,,book_record,https://lib.uidaho.edu/digital/objects/idahobib/ibp000.jpg,,
ibp1768,ibp000.jpg,An INEL chronicle: The history of the Idaho National Engineering Laboratory,United States,1974,,Nuclear,State of Idaho,44.0682,-114.742,,,Text,,eng,,,book_record,https://lib.uidaho.edu/digital/objects/idahobib/ibp000.jpg,,
ibp1769,ibp000.jpg,"Boise State University Library, the Moore-Cunningham-Bettis collection: A guide",Boise State University,1992,,Bibliographies,State of Idaho,44.0682,-114.742,,,Text,,eng,,,book_record,https://lib.uidaho.edu/digital/objects/idahobib/ibp000.jpg,,
ibp1770,ibp000.jpg,Idaho law-related state documents: An annotated bibliography,"Cervenka, P. A., Madden, J., Carlson, J., American Association of Law Libraries., & American Association of Law Libraries",1989,,Bibliographies,State of Idaho,44.0682,-114.742,,,Text,,eng,,,book_record,https://lib.uidaho.edu/digital/objects/idahobib/ibp000.jpg,,
ibp1771,ibp000.jpg,The Idaho index,"Davis, J., Wilson, W. J., & Boise Public Library",1990,,Bibliographies,State of Idaho,44.0682,-114.742,,,Text,,eng,,,book_record,https://lib.uidaho.edu/digital/objects/idahobib/ibp000.jpg,,
ibp1772,ibp000.jpg,Idaho history: A bibliography,"Domitz, G., Hitchcock, L., & Etulain, R. W.",1991,,Bibliographies,State of Idaho,44.0682,-114.742,,,Text,,eng,,,book_record,https://lib.uidaho.edu/digital/objects/idahobib/ibp000.jpg,,
ibp1773,ibp000.jpg,The Edward F. Rhodenbaugh Collection: A guide,"Edward F. Rhodenbaugh Collection (Boise State University), & Boise State University",1990,,Bibliographies,State of Idaho,44.0682,-114.742,,,Text,,eng,,,book_record,https://lib.uidaho.edu/digital/objects/idahobib/ibp000.jpg,,
ibp1774,ibp000.jpg,Idaho state documents: A bibliography of legal publications and related materials,"Greenlee, M. J., & American Association of Law Libraries",2003,,Bibliographies,State of Idaho,44.0682,-114.742,,,Text,,eng,,,book_record,https://lib.uidaho.edu/digital/objects/idahobib/ibp000.jpg,,
ibp1775,ibp000.jpg,Bibliography of Ezra Pound materials at the University of Idaho Library,"Hart, P. S.",1979,,Bibliographies,State of Idaho,44.0682,-114.742,,,Text,,eng,,,book_record,https://lib.uidaho.edu/digital/objects/idahobib/ibp000.jpg,,
ibp1776,ibp1776.jpg,"Dissertations and theses about Idaho, 1900-1988","Hitchcock, L., & Domitz, G.",1990,,Bibliographies,State of Idaho,44.0682,-114.742,,,Text,,eng,,,book_record,https://lib.uidaho.edu/digital/objects/idahobib/ibp1776.jpg,https://lib.uidaho.edu/digital/objects/idahobib/small/ibp1776_sm.jpg,https://lib.uidaho.edu/digital/objects/idahobib/thumbs/ibp1776_th.jpg
ibp1777,ibp000.jpg,Famous potatoes: A bibliography of publications concerning Idaho,"Hohmann, C., & University of Utah",1988,,Bibliographies,State of Idaho,44.0682,-114.742,,,Text,,eng,,,book_record,https://lib.uidaho.edu/digital/objects/idahobib/ibp000.jpg,,
ibp1778,ibp000.jpg,Idaho centennial publications: A resource guide to publications produced during Idaho's centennial celebration,"Idaho Centennial Foundation., & Idaho Centennial Commission",1991,,Bibliographies,State of Idaho,44.0682,-114.742,,,Text,,eng,,,book_record,https://lib.uidaho.edu/digital/objects/idahobib/ibp000.jpg,,
ibp1779,ibp000.jpg,The Idaho centennial archives: A summary guide,"Idaho State Archives., Peterson, M. L., Idaho Centennial Commission., & Idaho Centennial Foundation",1991,,Bibliographies,State of Idaho,44.0682,-114.742,,,Text,,eng,,,book_record,https://lib.uidaho.edu/digital/objects/idahobib/ibp000.jpg,,
ibp1780,ibp000.jpg,A list of references for Idaho history,Idaho State Historical Society,1959,,Bibliographies,State of Idaho,44.0682,-114.742,,,Text,,eng,,,book_record,https://lib.uidaho.edu/digital/objects/idahobib/ibp000.jpg,,
ibp1781,ibp000.jpg,Scholarly works on Idaho,Idaho State Historical Society,1960,,Bibliographies,State of Idaho,44.0682,-114.742,,,Text,,eng,,,book_record,https://lib.uidaho.edu/digital/objects/idahobib/ibp000.jpg,,
ibp1782,ibp000.jpg,Fur trade era (Idaho): [bibliography],Idaho State Historical Society,1962,,Bibliographies,State of Idaho,44.0682,-114.742,,,Text,,eng,,,book_record,https://lib.uidaho.edu/digital/objects/idahobib/ibp000.jpg,,
ibp1783,ibp000.jpg,Material available on microfilm from Idaho Historical Society,Idaho State Historical Society,1962,,Bibliographies,State of Idaho,44.0682,-114.742,,,Text,,eng,,,book_record,https://lib.uidaho.edu/digital/objects/idahobib/ibp000.jpg,,
ibp1784,ibp000.jpg,A select bibliography for Idaho history teachers,Idaho State Historical Society,1971,,Bibliographies,State of Idaho,44.0682,-114.742,,,Text,,eng,,,book_record,https://lib.uidaho.edu/digital/objects/idahobib/ibp000.jpg,,
ibp1785,ibp000.jpg,The Nampa image: A select bibliography,Idaho State Historical Society,1971,,Bibliographies,State of Idaho,44.0682,-114.742,,,Text,,eng,,,book_record,https://lib.uidaho.edu/digital/objects/idahobib/ibp000.jpg,,
ibp1786,ibp000.jpg,The Idaho Oral History Collection catalog,Idaho State Historical Society,1981,,Bibliographies,State of Idaho,44.0682,-114.742,,,Text,,eng,,,book_record,https://lib.uidaho.edu/digital/objects/idahobib/ibp000.jpg,,
ibp1787,ibp000.jpg,The mining industry in Idaho: A short bibliography of sources on mines and mining in the Idaho State Historical Society Library and Archives,Idaho State Historical Society,1992,,Bibliographies,State of Idaho,44.0682,-114.742,,,Text,,eng,,,book_record,https://lib.uidaho.edu/digital/objects/idahobib/ibp000.jpg,,
ibp1788,ibp000.jpg,Here we have Idaho: Books of fact & fiction,Idaho State Library,1963,,Bibliographies,State of Idaho,44.0682,-114.742,,,Text,,eng,,,book_record,https://lib.uidaho.edu/digital/objects/idahobib/ibp000.jpg,,
ibp1789,ibp000.jpg,"Idaho, the Gem State: A bibliography of books about Idaho and by Idaho authors","Idaho State Library., Selby, M., & Coventry, R",1966,,Bibliographies,State of Idaho,44.0682,-114.742,,,Text,,eng,,,book_record,https://lib.uidaho.edu/digital/objects/idahobib/ibp000.jpg,,
ibp1790,ibp000.jpg,"Idaho, 1890-1940",Idaho,1940,,Bibliographies,State of Idaho,44.0682,-114.742,,,Text,,eng,,,book_record,https://lib.uidaho.edu/digital/objects/idahobib/ibp000.jpg,,
ibp1791,ibp000.jpg,Selected library books for primary grades,Idaho,1960,,Bibliographies,State of Idaho,44.0682,-114.742,,,Text,,eng,,,book_record,https://lib.uidaho.edu/digital/objects/idahobib/ibp000.jpg,,
ibp1792,ibp000.jpg,Guide to the Idaho Folklore Archives,"Lawless, E. J., Idaho Folklife Archives., & Idaho Folklore Center",1983,,Bibliographies,State of Idaho,44.0682,-114.742,,,Text,,eng,,,book_record,https://lib.uidaho.edu/digital/objects/idahobib/ibp000.jpg,,
ibp1793,ibp1793.jpg,"A short-title check list of books, pamphlets, and broadsides printed in Idaho, 1839-1890","McMurtrie, D. C.",1938,,Bibliographies,State of Idaho,44.0682,-114.742,,,Text,,eng,,,book_record,https://lib.uidaho.edu/digital/objects/idahobib/ibp1793.jpg,https://lib.uidaho.edu/digital/objects/idahobib/small/ibp1793_sm.jpg,https://lib.uidaho.edu/digital/objects/idahobib/thumbs/ibp1793_th.jpg
ibp1794,ibp000.jpg,Bibliography of Idaho writers and writings,"Morton, M.",1954,,Bibliographies,State of Idaho,44.0682,-114.742,,,Text,,eng,,,book_record,https://lib.uidaho.edu/digital/objects/idahobib/ibp000.jpg,,
ibp1795,ibp000.jpg,"Writings about Idaho by non-Idahoans, past and present: First supplement","Morton, M.",,undated,Bibliographies,State of Idaho,44.0682,-114.742,,,Text,,eng,,,book_record,https://lib.uidaho.edu/digital/objects/idahobib/ibp000.jpg,,
ibp1796,ibp000.jpg,Idaho local history: A bibliography with a checklist of library holdings,"Nelson, M. G., Webbert, C. A., & Idaho Library Association",1976,,Bibliographies,State of Idaho,44.0682,-114.742,,,Text,,eng,,,book_record,https://lib.uidaho.edu/digital/objects/idahobib/ibp000.jpg,,
ibp1797,ibp000.jpg,"A bibliography of Idaho archaeology, 1889-1976","Pavesic, M. G., Plew, M. G., & Sprague, R.",1979,,Bibliographies,State of Idaho,44.0682,-114.742,,,Text,,eng,,,book_record,https://lib.uidaho.edu/digital/objects/idahobib/ibp000.jpg,,
ibp1798,ibp000.jpg,A bibliography about Boise,"Petersen, K.",1990,,Bibliographies,State of Idaho,44.0682,-114.742,,,Text,,eng,,,book_record,https://lib.uidaho.edu/digital/objects/idahobib/ibp000.jpg,,
ibp1799,ibp000.jpg,A guide to the local history library at the Latah County Historical Society,"Petersen, K., & Latah County Historical Society",1980,,Bibliographies,State of Idaho,44.0682,-114.742,,,Text,,eng,,,book_record,https://lib.uidaho.edu/digital/objects/idahobib/ibp000.jpg,,
ibp1800,ibp000.jpg,"A guide to historical and genealogical research libraries in Asotin County, Washington, Latah County, Idaho, Nez Perce County, Idaho, Whitman County, Washington","Petersen, K., & Latah County Historical Society",1983,,Bibliographies,State of Idaho,44.0682,-114.742,,,Text,,eng,,,book_record,https://lib.uidaho.edu/digital/objects/idahobib/ibp000.jpg,,
ibp1801,ibp1801.jpg,"Idaho chronology, nomenclature, bibliography","Rees, J. E.",1918,,Bibliographies,State of Idaho,44.0682,-114.742,,,Text,,eng,,,book_record,https://lib.uidaho.edu/digital/objects/idahobib/ibp1801.jpg,https://lib.uidaho.edu/digital/objects/idahobib/small/ibp1801_sm.jpg,https://lib.uidaho.edu/digital/objects/idahobib/thumbs/ibp1801_th.jpg
ibp1802,ibp000.jpg,Lewis and Clark: An annotated bibliography of recommended titles for libraries,"Simon-Smolinski, C., Idaho., & Idaho State Library",2005,,Bibliographies,State of Idaho,44.0682,-114.742,,,Text,,eng,,,book_record,https://lib.uidaho.edu/digital/objects/idahobib/ibp000.jpg,,
ibp1803,ibp000.jpg,Abridged bibliography of the mineral industry of the state of Idaho,"Staley, W. W.",1940,,Bibliographies,State of Idaho,44.0682,-114.742,,,Text,,eng,,,book_record,https://lib.uidaho.edu/digital/objects/idahobib/ibp000.jpg,,
ibp1804,ibp000.jpg,Jerome J. Day collection: A bibliography,"University of Idaho., Day, J., & Webbert, C. A.",1963,,Bibliographies,State of Idaho,44.0682,-114.742,,,Text,,eng,,,book_record,https://lib.uidaho.edu/digital/objects/idahobib/ibp000.jpg,,
ibp1805,ibp000.jpg,Palouse bibliography,"Von, S. M., & Carver, D.",1983,,Bibliographies,State of Idaho,44.0682,-114.742,,,Text,,eng,,,book_record,https://lib.uidaho.edu/digital/objects/idahobib/ibp000.jpg,,
ibp1806,ibp000.jpg,"Palouse bibliography: A listing of journal articles, theses, symposia, research reports, and monographs related to the Palouse geographic region and environs of southeastern Washington and northern Idaho","Von, S. M., & Kholdinasab, H.",1989,,Bibliographies,State of Idaho,44.0682,-114.742,,,Text,,eng,,,book_record,https://lib.uidaho.edu/digital/objects/idahobib/ibp000.jpg,,
ibp1807,ibp000.jpg,Selected bibliography on politics and government in Idaho,"Weatherby, J. B.",1972,,Bibliographies,State of Idaho,44.0682,-114.742,,,Text,,eng,,,book_record,https://lib.uidaho.edu/digital/objects/idahobib/ibp000.jpg,,
ibp1808,ibp000.jpg,Idaho--a bibliography,"Webbert, C. A.",1963,,Bibliographies,State of Idaho,44.0682,-114.742,,,Text,,eng,,,book_record,https://lib.uidaho.edu/digital/objects/idahobib/ibp000.jpg,,
ibp1809,ibp000.jpg,Books and pamphlets about Idaho,"Webbert, C. A.",1974,,Bibliographies,State of Idaho,44.0682,-114.742,,,Text,,eng,,,book_record,https://lib.uidaho.edu/digital/objects/idahobib/ibp000.jpg,,
ibp1810,ibp1810.jpg,"Los dos mundos: Rural Mexican Americans, another America","Baker, R.",1995,,Latinos,State of Idaho,44.0682,-114.742,,,Text,,eng,,,book_record,https://lib.uidaho.edu/digital/objects/idahobib/ibp1810.jpg,https://lib.uidaho.edu/digital/objects/idahobib/small/ibp1810_sm.jpg,https://lib.uidaho.edu/digital/objects/idahobib/thumbs/ibp1810_th.jpg
ibp1811,ibp000.jpg,"Los betabeleros: Hispanic sugar beet laborers in Cache Valley, 1941-1981","Cole, R. W.",2002,,Latinos,State of Idaho,44.0682,-114.742,,,Text,,eng,,,book_record,https://lib.uidaho.edu/digital/objects/idahobib/ibp000.jpg,,
ibp1812,ibp1812.jpg,"Mexican labor and World War II: Braceros in the Pacific Northwest, 1942-1947","Gamboa, E.",1990,,Latinos,State of Idaho,44.0682,-114.742,,,Text,,eng,,,book_record,https://lib.uidaho.edu/digital/objects/idahobib/ibp1812.jpg,https://lib.uidaho.edu/digital/objects/idahobib/small/ibp1812_sm.jpg,https://lib.uidaho.edu/digital/objects/idahobib/thumbs/ibp1812_th.jpg
ibp1813,ibp1813.jpg,Voces hispanas =: Hispanic voices of Idaho : excerpts from the Idaho Hispanic Oral History Project,"Gamboa, E., Idaho Commission on Hispanic Affairs., & Idaho Humanities Council",1992,,Latinos,State of Idaho,44.0682,-114.742,,,Text,,eng,,,book_record,https://lib.uidaho.edu/digital/objects/idahobib/ibp1813.jpg,https://lib.uidaho.edu/digital/objects/idahobib/small/ibp1813_sm.jpg,https://lib.uidaho.edu/digital/objects/idahobib/thumbs/ibp1813_th.jpg
ibp1814,ibp000.jpg,What makes them leave: The voices of six Latino students who did not graduate from high school,"Garci?a, S. I. M.",2002,,Latinos,State of Idaho,44.0682,-114.742,,,Text,,eng,,,book_record,https://lib.uidaho.edu/digital/objects/idahobib/ibp000.jpg,,
ibp1815,ibp000.jpg,From farms to fields to factories,"Glaser, D. P.",1963,,Latinos,State of Idaho,44.0682,-114.742,,,Text,,eng,,,book_record,https://lib.uidaho.edu/digital/objects/idahobib/ibp000.jpg,,
ibp1816,ibp000.jpg,Latino holiday celebration book,Idaho Commission on Hispanic Affairs,2005,,Latinos,State of Idaho,44.0682,-114.742,,,Text,,eng,,,book_record,https://lib.uidaho.edu/digital/objects/idahobib/ibp000.jpg,,
ibp1817,ibp000.jpg,Latino folklife in Idaho: A survey of Idaho Latino traditional arts : 2000-01,"Idaho Commission on the Arts., & Cantu?, N. E.",2000,,Latinos,State of Idaho,44.0682,-114.742,,,Text,,eng,,,book_record,https://lib.uidaho.edu/digital/objects/idahobib/ibp000.jpg,,
ibp1818,ibp000.jpg,The Hispanic experience in Idaho: Papers written for a research seminar at Boise State University,"Jones, E. D., Hodges, K. R., & Boise State University",1998,,Latinos,State of Idaho,44.0682,-114.742,,,Text,,eng,,,book_record,https://lib.uidaho.edu/digital/objects/idahobib/ibp000.jpg,,
ibp1819,ibp1819.jpg,Latinos in Idaho: Celebrando cultura,"McCarl, R., & Idaho Humanities Council",2003,,Latinos,State of Idaho,44.0682,-114.742,,,Text,,eng,,,book_record,https://lib.uidaho.edu/digital/objects/idahobib/ibp1819.jpg,https://lib.uidaho.edu/digital/objects/idahobib/small/ibp1819_sm.jpg,https://lib.uidaho.edu/digital/objects/idahobib/thumbs/ibp1819_th.jpg
ibp1820,ibp000.jpg,Idaho ethnic heritage,"Mercier, L., Simon-Smolinski, C., Rahde, B., Reed, M., Idaho Ethnic Heritage Project., & Idaho State Historical Society",1990,,Latinos,State of Idaho,44.0682,-114.742,,,Text,,eng,,,book_record,https://lib.uidaho.edu/digital/objects/idahobib/ibp000.jpg,,
ibp1821,ibp000.jpg,Claiming a place in the intermountain west: Japanese American ethnic identity in Utah and Idaho,"Miyasaki, J. T.",2006,,Latinos,State of Idaho,44.0682,-114.742,,,Text,,eng,,,book_record,https://lib.uidaho.edu/digital/objects/idahobib/ibp000.jpg,,
ibp1822,ibp000.jpg,Migrant workers in Idaho,"Ourada, P. K.",1980,,Latinos,State of Idaho,44.0682,-114.742,,,Text,,eng,,,book_record,https://lib.uidaho.edu/digital/objects/idahobib/ibp000.jpg,,
