objectid,filename,title,creator,date,description,subject,location,latitude,longitude,source,identifier,type,format,language,rights,rightsstatement,object_template,object_download,image_small,image_thumb
ibp1146,ibp000.jpg,"Phineus Tempest: Rexburg pioneer, 1845-1931","May, V. T.",2010,,Rexburg,Madison County,43.8231,-111.7924,,,Text,,eng,,,book_record,https://lib.uidaho.edu/digital/objects/idahobib/ibp000.jpg,,
ibp1147,ibp1147.jpg,"Remembering the Spori: A compilation of photos, memories, and essays commemorating the Jacob Spori Building","Moser, S., Poulter, L. N. H., & Memmott, B.",2001,,Rexburg,Madison County,43.8231,-111.7924,,,Text,,eng,,,book_record,https://lib.uidaho.edu/digital/objects/idahobib/ibp1147.jpg,https://lib.uidaho.edu/digital/objects/idahobib/small/ibp1147_sm.jpg,https://lib.uidaho.edu/digital/objects/idahobib/thumbs/ibp1147_th.jpg
ibp1148,ibp000.jpg,"Rexburg Book Lore Club, 1933-1993: A complete history of the ladies of the club","Parkinson, L. J., & Rexburg Book Lore Club",1993,,Rexburg,Madison County,43.8231,-111.7924,,,Text,,eng,,,book_record,https://lib.uidaho.edu/digital/objects/idahobib/ibp000.jpg,,
ibp1149,ibp1149.jpg,Rexburg best remembered: A city twice built on pioneer spirit,unknown,2002,,Rexburg,Madison County,43.8231,-111.7924,,,Text,,eng,,,book_record,https://lib.uidaho.edu/digital/objects/idahobib/ibp1149.jpg,https://lib.uidaho.edu/digital/objects/idahobib/small/ibp1149_sm.jpg,https://lib.uidaho.edu/digital/objects/idahobib/thumbs/ibp1149_th.jpg
ibp1150,ibp000.jpg,"Rexburg First Ward Relief Society, the first one hundred years 1884-1984",Rexburg First Ward Relief Society,1984,,Rexburg,Madison County,43.8231,-111.7924,,,Text,,eng,,,book_record,https://lib.uidaho.edu/digital/objects/idahobib/ibp000.jpg,,
ibp1151,ibp1151.jpg,"Rexburg's centennial, 1883-1983",Genealogical Society of Utah,1991,,Rexburg,Madison County,43.8231,-111.7924,,,Text,,eng,,,book_record,https://lib.uidaho.edu/digital/objects/idahobib/ibp1151.jpg,https://lib.uidaho.edu/digital/objects/idahobib/small/ibp1151_sm.jpg,https://lib.uidaho.edu/digital/objects/idahobib/thumbs/ibp1151_th.jpg
ibp1152,ibp1152.jpg,"History of Sugar City, Idaho. Sugar City, Idaho","Luke, L., Rognan, B., Jensen, N., & Jensen, A.",1981,,Sugar City,Madison County,48.873,-111.7483,,,Text,,eng,,,book_record,https://lib.uidaho.edu/digital/objects/idahobib/ibp1152.jpg,https://lib.uidaho.edu/digital/objects/idahobib/small/ibp1152_sm.jpg,https://lib.uidaho.edu/digital/objects/idahobib/thumbs/ibp1152_th.jpg
ibp1153,ibp000.jpg,The William Joel Worlton family history,"Porter, E. B. W.",1992,,Sugar City,Madison County,48.873,-111.7483,,,Text,,eng,,,book_record,https://lib.uidaho.edu/digital/objects/idahobib/ibp000.jpg,,
ibp1154,ibp000.jpg,"Eleven year history 1980-1991 of Sugar City Fourth Ward, Sugar City, Idaho","Southwick, N. S.",1992,,Sugar City,Madison County,48.873,-111.7483,,,Text,,eng,,,book_record,https://lib.uidaho.edu/digital/objects/idahobib/ibp000.jpg,,
ibp1155,ibp000.jpg,"The sweetest little town: A centennial history of Sugar City, Idaho 1903-2003","Worrell, R., & Brighton, B.",1971,,Sugar City,Madison County,48.873,-111.7483,,,Text,,eng,,,book_record,https://lib.uidaho.edu/digital/objects/idahobib/ibp000.jpg,,
ibp1156,ibp1156.jpg,Pioneering the Snake River fork country,"Clements, L. J., & Forbush, H. S.",1972,,Miscellaneous,Madison County,43.7508,-111.5584,,,Text,,eng,,,book_record,https://lib.uidaho.edu/digital/objects/idahobib/ibp1156.jpg,https://lib.uidaho.edu/digital/objects/idahobib/small/ibp1156_sm.jpg,https://lib.uidaho.edu/digital/objects/idahobib/thumbs/ibp1156_th.jpg
ibp1157,ibp000.jpg,Don Carlos Drigg[s] -- native pioneer,"Daughters of Utah Pioneers., & Cottam, N. M.",1993,,Miscellaneous,Madison County,43.7508,-111.5584,,,Text,,eng,,,book_record,https://lib.uidaho.edu/digital/objects/idahobib/ibp000.jpg,,
ibp1158,ibp000.jpg,"Plano Ward history, 1883-1985",Plano Ward,1985,,Miscellaneous,Madison County,43.7508,-111.5584,,,Text,,eng,,,book_record,https://lib.uidaho.edu/digital/objects/idahobib/ibp000.jpg,,
ibp1159,ibp000.jpg,Thirty years of progress in the Upper Snake River Valley,Rexburg Standard Newspaper,1915,,Miscellaneous,Madison County,43.7508,-111.5584,,,Text,,eng,,,book_record,https://lib.uidaho.edu/digital/objects/idahobib/ibp000.jpg,,
ibp1160,ibp1160.jpg,"Madison County best remembered: A centennial photo history, 1913-2013",Standard Journal,2012,,Miscellaneous,Madison County,43.7508,-111.5584,,,Text,,eng,,,book_record,https://lib.uidaho.edu/digital/objects/idahobib/ibp1160.jpg,https://lib.uidaho.edu/digital/objects/idahobib/small/ibp1160_sm.jpg,https://lib.uidaho.edu/digital/objects/idahobib/thumbs/ibp1160_th.jpg
ibp1161,ibp1161.jpg,"Madison County, 1913-1990","Wolf, M. L., Clements, L. J., & Madison County Courthouse Restoration Committee",1992,,Miscellaneous,Madison County,43.7508,-111.5584,,,Text,,eng,,,book_record,https://lib.uidaho.edu/digital/objects/idahobib/ibp1161.jpg,https://lib.uidaho.edu/digital/objects/idahobib/small/ibp1161_sm.jpg,https://lib.uidaho.edu/digital/objects/idahobib/thumbs/ibp1161_th.jpg
ibp1162,ibp000.jpg,"History of theatre and theatre curriculum at Ricks College, Rexburg, Idaho, through 1981","Bidwell, J. T.",1982,,Ricks College,Madison County,43.8144,-111.7833,,,Text,,eng,,,book_record,https://lib.uidaho.edu/digital/objects/idahobib/ibp000.jpg,,
ibp1163,ibp000.jpg,Oswald Christensen journals,"Christensen, O.",1902,,Ricks College,Madison County,43.8144,-111.7833,,,Text,,eng,,,book_record,https://lib.uidaho.edu/digital/objects/idahobib/ibp000.jpg,,
ibp1164,ibp000.jpg,"Arthur Porter, Jr., community builder, man of vision","Crowder, D. L.",1986,,Ricks College,Madison County,43.8144,-111.7833,,,Text,,eng,,,book_record,https://lib.uidaho.edu/digital/objects/idahobib/ibp000.jpg,,
ibp1165,ibp1165.jpg,The spirit of Ricks: A history of Ricks College,"Crowder, D. L",1997,,Ricks College,Madison County,43.8144,-111.7833,,,Text,,eng,,,book_record,https://lib.uidaho.edu/digital/objects/idahobib/ibp1165.jpg,https://lib.uidaho.edu/digital/objects/idahobib/small/ibp1165_sm.jpg,https://lib.uidaho.edu/digital/objects/idahobib/thumbs/ibp1165_th.jpg
ibp1166,ibp000.jpg,Autobiography of a school teacher,"Davis, R. J.",1967,,Ricks College,Madison County,43.8144,-111.7833,,,Text,,eng,,,book_record,https://lib.uidaho.edu/digital/objects/idahobib/ibp000.jpg,,
ibp1167,ibp000.jpg,"History of Ricks College Home Economic Department, 1888 to 1988","Lamprecht, H., & Ricks College",1988,,Ricks College,Madison County,43.8144,-111.7833,,,Text,,eng,,,book_record,https://lib.uidaho.edu/digital/objects/idahobib/ibp000.jpg,,
ibp1168,ibp000.jpg,Memoirs of President Hyrum Manwaring,"Manwaring, H.",2007,,Ricks College,Madison County,43.8144,-111.7833,,,Text,,eng,,,book_record,https://lib.uidaho.edu/digital/objects/idahobib/ibp000.jpg,,
ibp1169,ibp000.jpg,A brief history of Ricks College,"Ricks, N. E.",1970,,Ricks College,Madison County,43.8144,-111.7833,,,Text,,eng,,,book_record,https://lib.uidaho.edu/digital/objects/idahobib/ibp000.jpg,,
ibp1170,ibp000.jpg,The diary of a Ricks College summer teacher,"Smith, R.",1920,,Ricks College,Madison County,43.8144,-111.7833,,,Text,,eng,,,book_record,https://lib.uidaho.edu/digital/objects/idahobib/ibp000.jpg,,
ibp1171,ibp000.jpg,"Who's who in campus architecture: The buildings of Ricks College and BYU-Idaho, exhibition catalog","Twitchell, L. D.",2002,,Ricks College,Madison County,43.8144,-111.7833,,,Text,,eng,,,book_record,https://lib.uidaho.edu/digital/objects/idahobib/ibp000.jpg,,
ibp1172,ibp000.jpg,"Thomas E. Ricks, colonizer, founder","Wyler, W. R.",1989,,Ricks College,Madison County,43.8144,-111.7833,,,Text,,eng,,,book_record,https://lib.uidaho.edu/digital/objects/idahobib/ibp000.jpg,,
ibp1173,ibp1173.jpg,"Swedish homesteaders in Idaho: On the Minidoka irrigation project, Minidoka County, Idaho","Holmes, A. C.",1976,,Minidoka,Minidoka County,42.7538,-113.4903,,,Text,,eng,,,book_record,https://lib.uidaho.edu/digital/objects/idahobib/ibp1173.jpg,https://lib.uidaho.edu/digital/objects/idahobib/small/ibp1173_sm.jpg,https://lib.uidaho.edu/digital/objects/idahobib/thumbs/ibp1173_th.jpg
ibp1174,ibp000.jpg,"History of Minidoka Stake, 1924-1972","Blacker, L., & Church of Jesus Christ of Latter-day Saints",1980,,Minidoka,Minidoka County,42.7538,-113.4903,,,Text,,eng,,,book_record,https://lib.uidaho.edu/digital/objects/idahobib/ibp000.jpg,,
ibp1175,ibp000.jpg,"History of Rupert, Idaho","Taylor, P., Ricks, J. E., & Utah State University",1939,,Rupert,Minidoka County,42.6191,-113.6772,,,Text,,eng,,,book_record,https://lib.uidaho.edu/digital/objects/idahobib/ibp000.jpg,,
ibp1176,ibp000.jpg,"An urban study of Rupert, Idaho","Williams, S. E.",1963,,Rupert,Minidoka County,42.6191,-113.6772,,,Text,,eng,,,book_record,https://lib.uidaho.edu/digital/objects/idahobib/ibp000.jpg,,
ibp1177,ibp000.jpg,"Swedish homesteaders in Idaho on the Minidoka Irrigation Project, Minidoka County, Idaho","Holmes, A. C.",1976,,Miscellaneous,Minidoka County,42.841,-113.5808,,,Text,,eng,,,book_record,https://lib.uidaho.edu/digital/objects/idahobib/ibp000.jpg,,
ibp1178,ibp000.jpg,"Emerson, Idaho area history book: Dedicated to all the families who settled and lived in the area of Minidoka County known as Emerson","Merrill, K. C., & Church of Jesus Christ of Latter-day Saints",,undated,Miscellaneous,Minidoka County,42.841,-113.5808,,,Text,,eng,,,book_record,https://lib.uidaho.edu/digital/objects/idahobib/ibp000.jpg,,
ibp1179,ibp000.jpg,"A History of Minidoka County and its people, 1985",Minidoka County Historical Society,1985,,Miscellaneous,Minidoka County,42.841,-113.5808,,,Text,,eng,,,book_record,https://lib.uidaho.edu/digital/objects/idahobib/ibp000.jpg,,
ibp1180,ibp000.jpg,"Arid acres: A history of the Kimama-Minidoka homesteaders, 1912-1932","Riedesel, G. A.",1974,,Miscellaneous,Minidoka County,42.841,-113.5808,,,Text,,eng,,,book_record,https://lib.uidaho.edu/digital/objects/idahobib/ibp000.jpg,,
ibp1181,ibp000.jpg,"The Minidoka County news golden anniversary edition, 1905-1955",Minidoka County News,1955,,Miscellaneous,Minidoka County,42.841,-113.5808,,,Text,,eng,,,book_record,https://lib.uidaho.edu/digital/objects/idahobib/ibp000.jpg,,
ibp1182,ibp000.jpg,The Minidoka story: The land and the people in words and pictures,Minidoka County News,1963,,Miscellaneous,Minidoka County,42.841,-113.5808,,,Text,,eng,,,book_record,https://lib.uidaho.edu/digital/objects/idahobib/ibp000.jpg,,
ibp1183,ibp000.jpg,"Seattle, the internment and the church: Inside and outside Minidoka 1942-1948","Duntley, M., & American Society of Church History",1997,,Minidoka Relocation Center,Minidoka County,42.6667,-114.233,,,Text,,eng,,,book_record,https://lib.uidaho.edu/digital/objects/idahobib/ibp000.jpg,,
ibp1184,ibp000.jpg,"Internment and resistance: The Japanese American experience in the Minidoka Relocation Center, 1942-1945","Hall, D. L.",1987,,Minidoka Relocation Center,Minidoka County,42.6667,-114.233,,,Text,,eng,,,book_record,https://lib.uidaho.edu/digital/objects/idahobib/ibp000.jpg,,
ibp1185,ibp000.jpg,"History of the Japanese-American relocation center at Hunt, Minidoka County, Idaho","Hausler, D. E.",1964,,Minidoka Relocation Center,Minidoka County,42.6667,-114.233,,,Text,,eng,,,book_record,https://lib.uidaho.edu/digital/objects/idahobib/ibp000.jpg,,
ibp1186,ibp1186.jpg,Relocation center diary,"Kleinkopf, A., & Minidoka Internment National Monument",2003,,Minidoka Relocation Center,Minidoka County,42.6667,-114.233,,,Text,,eng,,,book_record,https://lib.uidaho.edu/digital/objects/idahobib/ibp1186.jpg,https://lib.uidaho.edu/digital/objects/idahobib/small/ibp1186_sm.jpg,https://lib.uidaho.edu/digital/objects/idahobib/thumbs/ibp1186_th.jpg
ibp1187,ibp000.jpg,The development of a junior-senior high school program in a relocation center for people of Japanese ancestry during the war with Japan,"Light, J. T.",1947,,Minidoka Relocation Center,Minidoka County,42.6667,-114.233,,,Text,,eng,,,book_record,https://lib.uidaho.edu/digital/objects/idahobib/ibp000.jpg,,
ibp1188,ibp1188.jpg,Looking after Minidoka,"Nakadate, N.",2013,,Minidoka Relocation Center,Minidoka County,42.6667,-114.233,,,Text,,eng,,,book_record,https://lib.uidaho.edu/digital/objects/idahobib/ibp1188.jpg,https://lib.uidaho.edu/digital/objects/idahobib/small/ibp1188_sm.jpg,https://lib.uidaho.edu/digital/objects/idahobib/thumbs/ibp1188_th.jpg
ibp1189,ibp1189.jpg,Kenjiro Nomura: An artist's view of the Japanese American internment,"Nomura, K.",1991,,Minidoka Relocation Center,Minidoka County,42.6667,-114.233,,,Text,,eng,,,book_record,https://lib.uidaho.edu/digital/objects/idahobib/ibp1189.jpg,https://lib.uidaho.edu/digital/objects/idahobib/small/ibp1189_sm.jpg,https://lib.uidaho.edu/digital/objects/idahobib/thumbs/ibp1189_th.jpg
ibp1190,ibp000.jpg,Hunt for Idaho: Evacuees 1942-1945 and hometeaders 1947-1949 T.P. Minidoka Prisoner of War Camp 1942-1945,"Roberts-Wright, B. M. S.",1994,,Minidoka Relocation Center,Minidoka County,42.6667,-114.233,,,Text,,eng,,,book_record,https://lib.uidaho.edu/digital/objects/idahobib/ibp000.jpg,,
ibp1191,ibp1191.jpg,Shadows of Minidoka: Paintings and collections of Roger Shimomura,"Shimomura, R., Ahlvers, B., Higa, K. M., Daniels, R., & Lawrence Arts Center",2011,,Minidoka Relocation Center,Minidoka County,42.6667,-114.233,,,Text,,eng,,,book_record,https://lib.uidaho.edu/digital/objects/idahobib/ibp1191.jpg,https://lib.uidaho.edu/digital/objects/idahobib/small/ibp1191_sm.jpg,https://lib.uidaho.edu/digital/objects/idahobib/thumbs/ibp1191_th.jpg
ibp1192,ibp1192.jpg,Minidoka: An American concentration camp,"Tamura, T.",2013,,Minidoka Relocation Center,Minidoka County,42.6667,-114.233,,,Text,,eng,,,book_record,https://lib.uidaho.edu/digital/objects/idahobib/ibp1192.jpg,https://lib.uidaho.edu/digital/objects/idahobib/small/ibp1192_sm.jpg,https://lib.uidaho.edu/digital/objects/idahobib/thumbs/ibp1192_th.jpg
ibp1193,ibp1193.jpg,Surviving Minidoka: The legacy of WWII Japanese American incarceration,"Tremayne, R. M., Shallat, T. A., Lavitt, M., Boise State University., & College of Southern Idaho",2013,,Minidoka Relocation Center,Minidoka County,42.6667,-114.233,,,Text,,eng,,,book_record,https://lib.uidaho.edu/digital/objects/idahobib/ibp1193.jpg,https://lib.uidaho.edu/digital/objects/idahobib/small/ibp1193_sm.jpg,https://lib.uidaho.edu/digital/objects/idahobib/thumbs/ibp1193_th.jpg
ibp1194,ibp000.jpg,"Highlights in Lewiston history: A full outline for the study of Lewiston development, every subject of major interest to the citizens of this community has received attention ; the story is brifly told beginning with the coming of Lewis and Clark in 1805 and ending with plans for the proposed Memorial bridge across the Clearwater River","Talkington, H. L.",1900,,Lewiston,Nez Perce County,46.4004,-117.0012,,,Text,,eng,,,book_record,https://lib.uidaho.edu/digital/objects/idahobib/ibp000.jpg,,
ibp1195,ibp1195.jpg,Lewiston country: An armchair history,"Allen, M. D., & Hamilton, L.",1990,,Lewiston,Nez Perce County,46.4004,-117.0012,,,Text,,eng,,,book_record,https://lib.uidaho.edu/digital/objects/idahobib/ibp1195.jpg,https://lib.uidaho.edu/digital/objects/idahobib/small/ibp1195_sm.jpg,https://lib.uidaho.edu/digital/objects/idahobib/thumbs/ibp1195_th.jpg
ibp1196,ibp1196.jpg,"Historic firsts of Lewiston, Idaho: Unintended greatness","Branting, S. D.",2013,,Lewiston,Nez Perce County,46.4004,-117.0012,,,Text,,eng,,,book_record,https://lib.uidaho.edu/digital/objects/idahobib/ibp1196.jpg,https://lib.uidaho.edu/digital/objects/idahobib/small/ibp1196_sm.jpg,https://lib.uidaho.edu/digital/objects/idahobib/thumbs/ibp1196_th.jpg
ibp1197,ibp1197.jpg,"Hidden history of Lewiston, Idaho","Branting, S. D.",2014,,Lewiston,Nez Perce County,46.4004,-117.0012,,,Text,,eng,,,book_record,https://lib.uidaho.edu/digital/objects/idahobib/ibp1197.jpg,https://lib.uidaho.edu/digital/objects/idahobib/small/ibp1197_sm.jpg,https://lib.uidaho.edu/digital/objects/idahobib/thumbs/ibp1197_th.jpg
ibp1198,ibp000.jpg,"Our community, old and new: The story of Lewiston, Nez Perce County, Idaho","Jones, R. G., & Best, C. A.",1966,,Lewiston,Nez Perce County,46.4004,-117.0012,,,Text,,eng,,,book_record,https://lib.uidaho.edu/digital/objects/idahobib/ibp000.jpg,,
ibp1199,ibp1199.jpg,Frontier Lewiston: 1861-1890,"Moore, M. C.",1980,,Lewiston,Nez Perce County,46.4004,-117.0012,,,Text,,eng,,,book_record,https://lib.uidaho.edu/digital/objects/idahobib/ibp1199.jpg,https://lib.uidaho.edu/digital/objects/idahobib/small/ibp1199_sm.jpg,https://lib.uidaho.edu/digital/objects/idahobib/thumbs/ibp1199_th.jpg
ibp1200,ibp000.jpg,"Lewiston: From packtrains and tent saloons to highways and brick stores : a century of progress, 1861-1962","Mueller, G.",1980,,Lewiston,Nez Perce County,46.4004,-117.0012,,,Text,,eng,,,book_record,https://lib.uidaho.edu/digital/objects/idahobib/ibp000.jpg,,
ibp1201,ibp1201.jpg,Lewiston: A pictorial history,"Mueller, G.",1986,,Lewiston,Nez Perce County,46.4004,-117.0012,,,Text,,eng,,,book_record,https://lib.uidaho.edu/digital/objects/idahobib/ibp1201.jpg,https://lib.uidaho.edu/digital/objects/idahobib/small/ibp1201_sm.jpg,https://lib.uidaho.edu/digital/objects/idahobib/thumbs/ibp1201_th.jpg
ibp1202,ibp000.jpg,"Lewiston: A bumpy start, 1861-1863","Van, A. T.",1985,,Lewiston,Nez Perce County,46.4004,-117.0012,,,Text,,eng,,,book_record,https://lib.uidaho.edu/digital/objects/idahobib/ibp000.jpg,,
ibp1203,ibp1203.jpg,Chinese at the confluence: Lewiston's other pioneers,"Wegars, P.",1993,,Lewiston,Nez Perce County,46.4004,-117.0012,,,Text,,eng,,,book_record,https://lib.uidaho.edu/digital/objects/idahobib/ibp1203.jpg,https://lib.uidaho.edu/digital/objects/idahobib/small/ibp1203_sm.jpg,https://lib.uidaho.edu/digital/objects/idahobib/thumbs/ibp1203_th.jpg
ibp1204,ibp000.jpg,Chinese at the confluence: Lewiston's beuk aie temple,"Wegars, P., & Lewis-Clark Center for Arts and History",2000,,Lewiston,Nez Perce County,46.4004,-117.0012,,,Text,,eng,,,book_record,https://lib.uidaho.edu/digital/objects/idahobib/ibp000.jpg,,
ibp1205,ibp000.jpg,Culdesac memories,Culdesac Gem Community,2002,,Culdesac,Nez Perce County,46.3756,-116.6763,,,Text,,eng,,,book_record,https://lib.uidaho.edu/digital/objects/idahobib/ibp000.jpg,,
ibp1206,ibp1206.jpg,"Frontier duty: The Army in northern Idaho, 1853-1876 : transcribed from the original records in the National Archives. Moscow, Idaho","Hanson, D. M., National Archives (U.S.), United States., & University of Idaho",2005,,Lapwai,Nez Perce County,46.4049,-116.8049,,,Text,,eng,,,book_record,https://lib.uidaho.edu/digital/objects/idahobib/ibp1206.jpg,https://lib.uidaho.edu/digital/objects/idahobib/small/ibp1206_sm.jpg,https://lib.uidaho.edu/digital/objects/idahobib/thumbs/ibp1206_th.jpg
ibp1207,ibp000.jpg,"William Craig in Nez Perce Country: Mountain man, interpreter, and Indian agent, 1807-1869","Baughman, B. E.",2003,,Miscellaneous,Nez Perce County,46.4182,-116.6229,,,Text,,eng,,,book_record,https://lib.uidaho.edu/digital/objects/idahobib/ibp000.jpg,,
ibp1208,ibp1208.jpg,"Two rivers, one history: Historic images of the Lewis-Clark Valley",Lewiston Tribune,2010,,Miscellaneous,Nez Perce County,46.4182,-116.6229,,,Text,,eng,,,book_record,https://lib.uidaho.edu/digital/objects/idahobib/ibp1208.jpg,https://lib.uidaho.edu/digital/objects/idahobib/small/ibp1208_sm.jpg,https://lib.uidaho.edu/digital/objects/idahobib/thumbs/ibp1208_th.jpg
ibp1209,ibp1209.jpg,Lewis and Clark's bittersweet crossing,"MacGregor, C. L., & Hoopes, G.",2004,,Miscellaneous,Nez Perce County,46.4182,-116.6229,,,Text,,eng,,,book_record,https://lib.uidaho.edu/digital/objects/idahobib/ibp1209.jpg,https://lib.uidaho.edu/digital/objects/idahobib/small/ibp1209_sm.jpg,https://lib.uidaho.edu/digital/objects/idahobib/thumbs/ibp1209_th.jpg
ibp1210,ibp1210.jpg,Past days of the Tammany-Waha area,"Meloy, B. T.",1982,,Miscellaneous,Nez Perce County,46.4182,-116.6229,,,Text,,eng,,,book_record,https://lib.uidaho.edu/digital/objects/idahobib/ibp1210.jpg,https://lib.uidaho.edu/digital/objects/idahobib/small/ibp1210_sm.jpg,https://lib.uidaho.edu/digital/objects/idahobib/thumbs/ibp1210_th.jpg
ibp1211,ibp1211.jpg,The story of Hells Canyon,"Tucker, G. J.",1993,,Miscellaneous,Nez Perce County,46.4182,-116.6229,,,Text,,eng,,,book_record,https://lib.uidaho.edu/digital/objects/idahobib/ibp1211.jpg,https://lib.uidaho.edu/digital/objects/idahobib/small/ibp1211_sm.jpg,https://lib.uidaho.edu/digital/objects/idahobib/thumbs/ibp1211_th.jpg
ibp1212,ibp000.jpg,Flying the golden years: A history of the Lewiston-Nez Perce County Regional Airport : in commemoration of it's 50th anniversary,"Turner, R. L.",1994,,Miscellaneous,Nez Perce County,46.4182,-116.6229,,,Text,,eng,,,book_record,https://lib.uidaho.edu/digital/objects/idahobib/ibp000.jpg,,
ibp1213,ibp1213.jpg,The Magruder murders: Coping with violence on the Idaho frontier,"Welch, J. C.",1991,,Miscellaneous,Nez Perce County,46.4182,-116.6229,,,Text,,eng,,,book_record,https://lib.uidaho.edu/digital/objects/idahobib/ibp1213.jpg,https://lib.uidaho.edu/digital/objects/idahobib/small/ibp1213_sm.jpg,https://lib.uidaho.edu/digital/objects/idahobib/thumbs/ibp1213_th.jpg
ibp1214,ibp1214.jpg,Nez Perce Indian war and original stories,"Adkison, N. B.",1966,,Nez Perce Tribe,Nez Perce County,46.4182,-116.6229,,,Text,,eng,,,book_record,https://lib.uidaho.edu/digital/objects/idahobib/ibp1214.jpg,https://lib.uidaho.edu/digital/objects/idahobib/small/ibp1214_sm.jpg,https://lib.uidaho.edu/digital/objects/idahobib/thumbs/ibp1214_th.jpg
ibp1215,ibp000.jpg,Indian braves and battles with more Nez Perce lore,"Adkison, N. B.",1967,,Nez Perce Tribe,Nez Perce County,46.4182,-116.6229,,,Text,,eng,,,book_record,https://lib.uidaho.edu/digital/objects/idahobib/ibp000.jpg,,
ibp1216,ibp1216.jpg,"Last trail to Bear Paw: Flight of the Nez Perces, 1877","Alcorn, R. L.",1877,,Nez Perce Tribe,Nez Perce County,46.4182,-116.6229,,,Text,,eng,,,book_record,https://lib.uidaho.edu/digital/objects/idahobib/ibp1216.jpg,https://lib.uidaho.edu/digital/objects/idahobib/small/ibp1216_sm.jpg,https://lib.uidaho.edu/digital/objects/idahobib/thumbs/ibp1216_th.jpg
ibp1217,ibp1217.jpg,"Timothy, a Nez Perce chief, 1800-1891","Alcorn, R. L.",1985,,Nez Perce Tribe,Nez Perce County,46.4182,-116.6229,,,Text,,eng,,,book_record,https://lib.uidaho.edu/digital/objects/idahobib/ibp1217.jpg,https://lib.uidaho.edu/digital/objects/idahobib/small/ibp1217_sm.jpg,https://lib.uidaho.edu/digital/objects/idahobib/thumbs/ibp1217_th.jpg
ibp1218,ibp1218.jpg,"Paul Kane: ""Frontier artist and Indian painter""","Alcorn, R. L., & Alcorn, G. D.",1971,,Nez Perce Tribe,Nez Perce County,46.4182,-116.6229,,,Text,,eng,,,book_record,https://lib.uidaho.edu/digital/objects/idahobib/ibp1218.jpg,https://lib.uidaho.edu/digital/objects/idahobib/small/ibp1218_sm.jpg,https://lib.uidaho.edu/digital/objects/idahobib/thumbs/ibp1218_th.jpg
ibp1219,ibp000.jpg,Jackson Sundown: Nez Perce horseman,"Alcorn, R. L., & Alcorn, G. D.",1983,,Nez Perce Tribe,Nez Perce County,46.4182,-116.6229,,,Text,,eng,,,book_record,https://lib.uidaho.edu/digital/objects/idahobib/ibp000.jpg,,
ibp1220,ibp1220.jpg,Nez Perce? Indian portraits,"Alcorn, R. L., & Chelan County Public Utility District No. 1",1990,,Nez Perce Tribe,Nez Perce County,46.4182,-116.6229,,,Text,,eng,,,book_record,https://lib.uidaho.edu/digital/objects/idahobib/ibp1220.jpg,https://lib.uidaho.edu/digital/objects/idahobib/small/ibp1220_sm.jpg,https://lib.uidaho.edu/digital/objects/idahobib/thumbs/ibp1220_th.jpg
ibp1221,ibp1221.jpg,Nez Perce texts,"Aoki, H.",1979,,Nez Perce Tribe,Nez Perce County,46.4182,-116.6229,,,Text,,eng,,,book_record,https://lib.uidaho.edu/digital/objects/idahobib/ibp1221.jpg,https://lib.uidaho.edu/digital/objects/idahobib/small/ibp1221_sm.jpg,https://lib.uidaho.edu/digital/objects/idahobib/thumbs/ibp1221_th.jpg
ibp1222,ibp1222.jpg,Nez Perce narratives,"Aoki, H., & Walker, D. E.",1988,,Nez Perce Tribe,Nez Perce County,46.4182,-116.6229,,,Text,,eng,,,book_record,https://lib.uidaho.edu/digital/objects/idahobib/ibp1222.jpg,https://lib.uidaho.edu/digital/objects/idahobib/small/ibp1222_sm.jpg,https://lib.uidaho.edu/digital/objects/idahobib/thumbs/ibp1222_th.jpg
ibp1223,ibp1223.jpg,"River of No Return (The great Salmon River of Idaho): A century of central Idaho and eastern Washington history and development together with the wars, customs, myths, and legends of the Nez Perce Indians","Bailey, R. G.",1948,,Nez Perce Tribe,Nez Perce County,46.4182,-116.6229,,,Text,,eng,,,book_record,https://lib.uidaho.edu/digital/objects/idahobib/ibp1223.jpg,https://lib.uidaho.edu/digital/objects/idahobib/small/ibp1223_sm.jpg,https://lib.uidaho.edu/digital/objects/idahobib/thumbs/ibp1223_th.jpg
ibp1224,ibp1224.jpg,In Nez Perce country: Accounts of the Bitterroots and the Clearwater after Lewis and Clark,"Baird, L., & Baird, D. W.",2003,,Nez Perce Tribe,Nez Perce County,46.4182,-116.6229,,,Text,,eng,,,book_record,https://lib.uidaho.edu/digital/objects/idahobib/ibp1224.jpg,https://lib.uidaho.edu/digital/objects/idahobib/small/ibp1224_sm.jpg,https://lib.uidaho.edu/digital/objects/idahobib/thumbs/ibp1224_th.jpg
ibp1225,ibp000.jpg,"Tsceminicum, land of Coyote: Legends of the Nez Perces","Beall, T., Leeper, R. D., & Idaho",1971,,Nez Perce Tribe,Nez Perce County,46.4182,-116.6229,,,Text,,eng,,,book_record,https://lib.uidaho.edu/digital/objects/idahobib/ibp000.jpg,,
ibp1226,ibp1226.jpg,Jacob Horner and the Indian campaigns of 1876 and 1877,"Burdick, U. L., & Hart, E. D.",1942,,Nez Perce Tribe,Nez Perce County,46.4182,-116.6229,,,Text,,eng,,,book_record,https://lib.uidaho.edu/digital/objects/idahobib/ibp1226.jpg,https://lib.uidaho.edu/digital/objects/idahobib/small/ibp1226_sm.jpg,https://lib.uidaho.edu/digital/objects/idahobib/thumbs/ibp1226_th.jpg
